content,category
"Almagro continues Spanish surge

Unseeded Nicolas Almagro became the fifth Spaniard to reach the last eight at the Buenos Aires Open, ousting eighth seed Mariano Zabaleta.

He showed admirable resolve to win a rain-affected match 6-7 6-4 6-4. Compatriot and seventh seed Rafael Nadal also reached the last eight, beating Italian Potito Starace 6-1 6-3. Nadal, playing in the outdoor clay event for the first time, hit some powerful forehands to oust Starace in a match delayed over an hour by rain. ""It's always a problem to have to stop for rain but one gets used to it,"" said Spanish teenager Nadal. ""Luckily, I was able to keep my pace going throughout the match."" He will now play Gaston Gaudio, who beat unseeded Brazilian Flavio Saretta 6-3 6-2 in the day's late match.
",sport
"Federer breezes into semi-finals

Roger Federer reached the last four of the Qatar Open with an easy 6-1 6-2 win over seventh seed Feliciano Lopez.

The Swiss world number one reeled off a series winners to outclass the Spaniard and set up a semi-final match against Russian Nikolay Davydenko. Federer, who lost in the quarter-final in his last Qatar appearance in 2003, was happy with his form. ""I think I played better than against Greg Rusedski and I am happy I am playing so well,"" said the top seed. Lopez showed glimpses of resolve early in the second set when he held his first service game and came close to breaking Federer. But the Swiss saved a break point and promptly broke serve in the following game to seize control. Davydenko, meanwhile, upset French third seed Sebastien Grosjean 2-6 6-3 6-2. Fabrice Santoro completed a miserable day for France when he was forced to retire when 6-2 3-0 down to Albert Costa. Spaniard Costa will next face Croatian Ivan Ljubicic after the sixth seed beat Rafael Nadal 6-2 6-7 (3/7) 6-3.
",sport
"Koubek suspended after drugs test

Stefan Koubek says he has been banned for three months by the International Tennis Federation (ITF) after testing positive for a banned substance.

The world number 60 failed a routine drugs test at this year's French Open but now plans to lodge an appeal. Koubek believes an injection given to him by an Austrian doctor to treat a wrist injury is to blame for producing traces of the substance in his system. ""I have acted correctly,"" the 27-year-old Austrian said in a statement. Koubek, who defeated Britain's Greg Rusedski in the decisive rubber of the Davis Cup in September, is now set to miss the start of the season. He said, ""A three-month ban would mean that I not only will miss the Australian Open, but also the Davis Cup in Australia.""
",sport
"Soderling wins tense Milan final

Fifth seed Robin Soderling took the Milan Indoors title with a dramatic win over Radek Stepanek in Sunday's final.

The 20-year-old Swede edged the final set tie-break for a 6-3 6-7 (2-7) 7-6 (7-5) victory and his second tour title after winning in Lyon last year. ""I'm delighted to have won against such a good opponent in a tournament of this importance,"" said Soderling. ""I was really on form, my service was good and I really liked playing on the synthetic surface."" Soderling, the world number 37, shrugged off a nervous start to take the opening set on his first set point. A change in approach from fourth seed Stepanek in the second set paid dividends as he took it on a tie-break, but Soderling's superior power proved too much in the third.
",sport
"Prodigy Monfils blows away Gaudio

French prodigy Gael Monfils underlined his huge promise by beating French Open champion Gaston Gaudio 6-4 7-6 (7-4) in the first round of the Qatar Open.

The 18-year-old wild card won three of the four junior Grand Slam events last year, including Wimbledon. Fabrice Santoro, the 2000 champion, beat Sweden's Thomas Johansson 6-4 6-2 but fourth seed Mikhail Youzhny lost 6-3 7-6 (7-3) to Rafael Nadal. Roger Federer plays Greg Rusedski in the second round on Wednesday. Monfils, who was given a wildcard into the tournament, said: ""This is my first win over a top 10 player and I am delighted. ""I play my best tennis when I am fired up on the court and the reason I won today was because I was able to play my natural, attacking game,"" he said. ""Of course I was a bit tired in the second set. But I was confident I could survive had there been a third set.""
",sport
"Capriati to miss Melbourne

Jennifer Capriati has become the third leading lady to withdraw from the Australian Open because of injury.

The organisers of the first grand slam of 2005, which begins on 17 January, said the American has a problem with her right shoulder. It comes as a blow to the women's draw as last year's champion, Justin Henin-Hardenne, and runner-up, Kim Clijsters, will also be absent. Capriati is a two-time champion in Melbourne with wins in 2001 and 2002. She is believed to have picked up the injury at the Advanta Championships at Philadelphia in November and had to pull out of an exhibition match with Wimbledon champion Maria Sharapova on 17 December. Capriati also decided against competing in the Australian Open warm-up event, the Sydney International.
",sport
"Capriati out of Australian Open

Jennifer Capriati has become the third leading lady to withdraw from the Australian Open because of injury.

The organisers of the first grand slam of 2005, which begins on 17 January, said the American has a problem with her right shoulder. It comes as a blow to the women's draw as last year's champion, Justin Henin-Hardenne, and runner-up, Kim Clijsters, will also be absent. Capriati is a two-time champion in Melbourne with wins in 2001 and 2002. She is believed to have picked up the injury at the Advanta Championships at Philadelphia in November and had to pull out of an exhibition match with Wimbledon champion Maria Sharapova on 17 December. Capriati also decided against competing in the Australian Open warm-up event, the Sydney International.
",sport
"Davenport puts retirement on hold

Lindsay Davenport has put any talk of retirement on hold after having a largely injury-free 2004 campaign.

The 28-year-old world number one had said that she would quit at the end of last year, but after a successful season she has had a change of heart. ""Finally I felt I put myself in a position to try and win Grand Slams again,"" said Davenport. ""It would be tough to walk away when I feel like I can contend so there's no point in hanging it up quite yet."" Davenport has won three Grand Slams, the 2000 Australian Open, Wimbledon in 1999 and the 1998 US Open. Her career has been hit by a series of injuries but last year she started hitting top form and won seven titles. She was due to take part in this week's Hopman Cup in Perth but decided she wanted to rest her knee. ""I just really wanted to make sure my right knee was going to be able to really withstand all the rigours of the whole year coming up,"" she said.
",sport
