content,category
"Saudi investor picks up the Savoy

London's famous Savoy hotel has been sold to a group combining Saudi billionaire investor Prince Alwaleed bin Talal and a unit of HBOS bank.

Financial details of the deal, which includes the nearby Simpson's in the Strand restaurant, were not disclosed. The seller - Irish-based property firm Quinlan Private - bought the Savoy along with the Berkeley, Claridge's and the Connaught for £750m last year. Prince Alwaleed's hotel investments include the luxury George V in Paris. He also has substantial stakes in Fairmont Hotels & Resorts, which will manage the Savoy and Simpson's in the Strand, and Four Seasons. Fairmont said it planned to invest $48m (£26m) in renovating parts of the Savoy including the River Room and suites with views over the River Thames. Work was expected to be completed by summer 2006, Fairmont said.
",business
"Lacroix label bought by US firm

Luxury goods group LVMH has sold its loss-making Christian Lacroix clothing label to a US investment group.

The Paris-based firm has been shedding non-core businesses and focusing on its most profitable brands including Moet & Chandon champagne and Louis Vuitton. LVMH said the French designer's haute couture and ready-to-wear labels had been purchased by the Falic Group for an unspecified sum. The Falic Group bought two cosmetics labels from LVMH in 2003. The sale of the Lacroix label comes as many fashion houses are struggling to make money from their expensive haute couture ranges. The Florida-based Falic group, which also runs a chain of 90 duty free stores in the US, said it planned to expand the brand by opening new stores. Mr Lacroix said he planned to stay at the label he founded in 1987 although exact details are still to be confirmed.
",business
"Parmalat bank barred from suing

Bank of America has been banned from suing Parmalat, the food group which went bust in 2003 after an accounting scandal.

The bank - along with investors, auditors and the group's managers - wants damages for being a victim of fraud at the hands of the Italian firm. But a judge has barred Bank of America and two auditors from the case. The bank, and Italaudit - formerly the Italian arm of auditor Grant Thornton - face lawsuits and possible prosecution. A second auditor, Deloitte & Touche, has also been banned from the case. Grant Thornton - now rid of the Italian unit at the centre of the case - is still being permitted to sue, as are Consob, Italy's stock market regulator, hundreds of small investors and Parmalat's new managers. Parmalat collapsed in December 2003 after it emerged that the 4bn euros ($5.2bn; £2.8bn) it supposedly held in a Bank of American offshore account did not in fact exist.
",business
"Virgin Blue shares plummet 20%

Shares in Australian budget airline Virgin Blue plunged 20% after it warned of a steep fall in full year profits.

Virgin Blue said profits after tax for the year to March would be between 10% to 15% lower than the previous year. ""Sluggish demand reported previously for November and now December 2004 continues,"" said Virgin Blue chief executive Brett Godfrey. Virgin Blue, which is 25% owned by Richard Branson, has been struggling to fend off pressure from rival Jetstar. It cut its full year passenger number forecast by ""approximately 2.5%"". Virgin Blue reported a 22% fall in first quarter profits in August 2004 due to tough competition. In November, first half profits were down due to slack demand and rising fuel costs. Virgin Blue was launched four years ago and now has roughly one third of Australia's domestic airline market. But the national carrier, Qantas, has fought back with its own budget airline, Jetstar, which took to the skies in May 2004. Sydney-listed Virgin Blue's shares recovered slightly to close 12% down on Wednesday. Shares in its major shareholder, Patrick Corporation - which owns 46% of Virgin Blue - had dropped 31% by the close.
",business
"Two Nigerian banks set to merge

Nigerian banks United Bank of Africa and Standard Trust Bank have agreed plans to merge and create the biggest bank in West Africa.

The deal is also in line with a 2004 directive from the Nigerian central bank that called for more consolidation in the nation's crowded banking sector. The merger was announced in a statement on Standard Trust's website on Tuesday, but no financial details were revealed. United Bank is the third biggest in Nigeria in terms of number of branches. Standard Trust is smaller but more profitable. ""The boards of United Bank and Standard Trust, at separate meetings yesterday, approved arrangements to merge both institutions,"" Standard Trust said. Standard Trust is 100% Nigerian-owned, but United Bank has some foreign investors, including New York-based Global Depository Receipts (32.8%), and Banca Nazionale del Lavoro and Monte del Paschi di Siena, both from Italy, who each have a 2.4% stake.
",business
"Mitsubishi in Peugeot link talks

Trouble-hit Mitsubishi Motors is in talks with French carmaker PSA Peugeot Citroen about a possible alliance.

On Tuesday Mitsubishi, the only major Japanese car firm in the red, confirmed earlier reports of negotiations. But a spokesman refused to comment on speculation that Mitsubishi could end up building cars for PSA and perhaps its Japanese rival Nissan. Mitsubishi has been hit by a recall scandal and the withdrawal of support from shareholder DaimlerChrysler. The US-German firm, once a majority shareholder, decided last April to stop providing financial backing. Mitsubishi's sales have slid 41% in the past year, catalysed by the revelation that the company had systematically been hiding records of faults and then secretly repairing vehicles. Mitsubishi is due to unveil a recovery plan later in January. Analysts said that alliances with other carmakers would be a necessary part of whatever it came up with, not least because its own slow sales have left its manufacturing capacity under-used.
",business
"Cairn Energy in Indian gas find

Shares in Cairn Energy rose 3.8% to 1,088 pence on Tuesday after the UK firm announced a fresh gas discovery in northern India.

The firm, which last year made a number of other new finds in the Rajasthan area, said the latest discovery could lead to large gas volumes. However, chief executive Bill Gammell cautioned that additional evalution was first needed at the site. Cairn has also been granted approval to extend its Rajasthan exploration area. This approval has come from the Indian government.

A spokesman said the company's decision to carry out further investigations at the new find showed that it believed there was significant gas. But he added: ""It's still too early to say what the extent of it is."" Cairn's string of finds in Rajasthan last year saw it elevated to the FTSE 100 index of the UK's leading listed companies. The company had bought the rights to explore in the area from oil giant Shell. Mr Gammell is a former Scottish international rugby player.
",business
"Wipro beats forecasts once again

Wipro, India's third-biggest software firm, has reported a 60% rise in profit, topping market expectations.

Net income in the last quarter was 4.3bn rupees ($98m; £52m), against 2.7bn a year earlier. Profit had been forecast to be 4.1bn rupees. Wipro offers services such as call centres to foreign clients and has worked for more than half of the companies on the Fortune 500 list. Wipro said demand was strong, allowing it to increase the prices it charged.

""On the face of it, the results don't look very exciting,"" said Apurva Shah, an analyst at ASK-Raymond James. ""But the guidance is positive and pricing going up is good news."" Third-quarter sales rose 34% to 20.9bn rupees. One problem identified by Wipro was the high turnover of its staff. It said that 90% of employees at its business process outsourcing operations had had to be replaced. ""We have to get that under control,"" said vice-chairman Vivek Paul. Wipro is majority owned by India's richest man Azim Premji.
",business
"US economy still growing says Fed

Most areas of the US saw their economy continue to expand in December and early January, the US Federal Reserve said in its latest Beige Book report.

Of the 12 US regions it identifies for the study, 11 showed stronger economic growth, with only the Cleveland area falling behind with a ""mixed"" rating. Consumer spending was higher in December than November, and festive sales were also up on 2003. The employment picture also improved, the Fed said.

""Labour markets firmed in a number of districts, but wage pressures generally remained modest,"" the Beige Book said. ""Several districts reported higher prices for building materials and manufacturing inputs, but most reported steady or only slightly higher overall price levels."" The report added that residential real estate activity remained strong and that commercial real estate activity strengthened in most districts. ""Office leasing was especially brisk in Washington DC, and New York City, two of the nation's strongest commercial markets,"" the Fed said.
",business
"BA to suspend two Saudi services

British Airways is to halt its flights from London Heathrow to Jeddah and Riyadh in Saudi Arabia from 27 March.

The airline said the decision was a commercial one due to reduced passenger demand for the services. BA currently operates four flights per week from Heathrow to Jeddah, and three weekly journeys to Riyadh. It suspended flights to Saudi Arabia for three weeks in autumn 2003 after a government warning about a ""threat to UK aviation interests in Saudi Arabia"".

BA will now suspend the Saudi flights - which it says will remain ""under constant review"" - from 27 March. ""The decision to suspend flights between the UK and Saudi Arabia is a difficult one to make as we have enjoyed a long history of flying between the two countries,"" said BA director of commercial planning, Robert Boyle. ""However, the routes don't currently make a profitable contribution to our business and we are unable to sustain them while this remains the case."" Passengers with flights booked after the suspension date will be contacted by BA for alternative arrangements to be made.
",business
"Ailing EuroDisney vows turnaround

EuroDisney, the European home of Mickey Mouse and friends, has said it will sell 253m euros (£175m; $328m) of new shares as it looks to avoid insolvency.

The sale is the last part of a plan to restructure 2.4bn euros-worth of debts. Despite struggling since it was opened in 1992, EuroDisney has recently made progress in turning its business around and ticket sales have picked up. However, analysts still question whether it attracts enough visitors to stay open, even with the restructuring.

EuroDisney remains Europe's largest single tourist attraction, attracting some 12.4 million visitors annually. A new attraction - Walt Disney Studios - has recently opened its site near Paris. The company's currently traded stock tumbled in Paris on the latest news, shedding 15% to 22 euro cents. EuroDisney will sell the new shares priced at 9 euros cents each. The US Disney Corporation and Saudi Arabian prince Al-Walid bin Talal, the firm's two main shareholders, will buy the new stock. The restructuring deal is the second in the firm's troubled financial history; its finances were first reorganised in 1994.
",business
"Europe asks Asia for euro help

European leaders say Asian states must let their currencies rise against the US dollar to ease pressure on the euro.

The European single currency has shot up to successive all-time highs against the dollar over the past few months. Tacit approval from the White House for the weaker greenback, which could help counteract huge deficits, has helped trigger the move. But now Europe says the euro has had enough, and Asia must now share some of the burden.

China is seen as the main culprit, with exports soaring up 35% in 2004 partly on the back of a currency pegged to the dollar. ""Asia should engage in greater currency flexibility,"" said French finance minister Herve Gaymard, after a meeting with his German counterpart Hans Eichel. Markets responded by pushing the euro lower, in the expectation that the rhetoric - and the pressure - is unlikely to ease ahead of a meeting of the G7 industrialised countries next week. Early on Tuesday morning, the dollar had edged higher to 1.3040 euros. The yen, meanwhile, had strengthened to 102.975 against the dollar by 0730 GMT.
",business
"Low-cost airlines hit Eurotunnel

Channel Tunnel operator Eurotunnel has seen sales fall in the face of the upsurge in European low-cost airlines.

The firm said sales were down 4% in 2004 to 789m euros ($1.03bn; £548m). ""The impact of the development of no-frills airlines is being felt ever more strongly,"" said chief executive Jean-Louis Raymond. Income from its vehicle-carrying shuttle services fell 7%, although 15% more passengers meant a 2% rise in railway revenue.

The cross-Channel truck market is improving, Eurotunnel said, but warned that it was not benefiting since much of the traffic was in containers destined for ports. The passenger-only trains which use the tunnel are run by a separate company, Eurostar.

Eurotunnel is still struggling with debts of more than 6bn euros. The company is currently kept afloat by the 200-plus banks to whom it owes the money. A shareholder revolt threw out the old board in 2004. But the BBC's business editor, Jeff Randall, said the banks could yet step in and take over altogether. ""At the moment it can't even service the interest on its debt,"" he said. ""This is a company in the departure lounge of life.""
",business
"Gazprom 'in $36m back-tax claim'

The nuclear unit of Russian energy giant Gazprom is reportedly facing a 1bn rouble ($35.7m; £19.1m) back-tax claim for the 2001-2003 period.

Vedomosti newspaper reported that Russian authorities made the demand at the end of last year. The paper added that most of the taxes claimed are linked to the company's export activity. Gazprom, the biggest gas company in the world, took over nuclear fuel giant Atomstroieksport in October 2004. The main project of Atomstroieksport is the building of a nuclear plant in Iran, which has been a source of tension between Russia and the US.

Gazprom is one of the key players in the complex Russian energy market, where the government of Vladimir Putin has made moves to regain state influence over the sector. Gazprom is set to merge with state oil firm Rosneft, the company that eventually acquired Yuganskneftegas, the main unit of embattled oil giant Yukos. Claims for back-taxes was a tool used against Yukos, and led to the enforced sale Yuganskneftegas. Some analysts fear the Kremlin will continue to use these sort of moves to boost the efforts of the state to regain control over strategically important sectors such as oil.
",business
"European losses hit GM's profits

General Motors (GM) saw its net profits fall 37% in the last quarter of 2004, as it continued to be hit by losses at its European operations.

The US giant earned $630m (£481.5m) in the October-to-December period, down from $1bn in the fourth quarter of 2003. GM's revenues rose 4.7% to $51.2bn from $48.8bn a year earlier. The fourth-quarter losses at General Motors Europe totalled $345m, up from $66m during the same period in 2003. GM's main European brands are Opel and Vauxhall.

Excluding special items, GM's global income from continuing operations totalled $569m during the quarter, down from $838m a year earlier. The results were in line with Wall Street expectations and shares in GM rose by about 1% in pre-market trade. For the whole of 2004, GM earned $3.7bn, down from $3.8bn in 2003, while its annual revenue rose 4.5% to $193bn. GM said its profits were also hit by higher healthcare costs in the US. ""GM reported solid overall results in 2004, despite challenging competitive conditions in many markets around the globe,"" GM chairman and chief executive Rick Wagoner said in a statement. The company recently announced that it expected profits in 2005 to be lower than in 2004.
",business
"Kraft cuts snack ads for children

Kraft plans to cut back on advertising of products like Oreo cookies and sugary Kool-Aid drinks as part of an effort to promote healthy eating.

The largest US food maker will also add a label to its more nutritional and low-fat brands to promote the benefits. Kraft rival PepsiCo began a similar labelling initiative last year. The moves come as the firms face criticism from consumer groups concerned at rising levels of obesity in US children. Major food manufacturers have recently been reformulating the content of some calorie-heavy products.

Kraft's new advertising policy, which covers advertising on TV, radio and in print publications, is aimed at children between the ages of six and 11. It means commercials for some of its most famous snacks and cereals shown during early morning cartoon shows on TV will now be replaced by food and drink qualifying for Kraft's new ""Sensible Solution"" label. But the firm said it would continue to advertise all its products in media seen by parents and ""all family"" audiences. ""We're working on ways to encourage both adults and children to eat wisely by selecting more nutritionally balanced diets,"" said Lance Friedmann, Kraft senior vice president.
",business
"Algeria hit by further gas riots

Algeria suffered a weekend of violent protests against government plans to raise gas prices, local press reports.

Demonstrators in a number of regions blocked roads, attacked public buildings and overturned vehicles, newspapers including El Watan reported. The price of butane gas, a vital fuel for cooking, has risen to 200 dinars ($2.77) per canister from 170 dinars. Even before the hike, failing economic conditions had been fanning resentment in some of Algeria's poorest regions.

Demonstrators took to the streets last week when the cost change was first announced, but police seemed to have restored order. According to local press reports, trouble flared up again on Saturday and carried on into Sunday. El Watan said that a number of hot spots centred on the villages and towns close to Bouira, about 100 kilometres (60 miles) south of the capital Algiers. Among the other main areas affected were the western Tiaret region and Sidi Ammar in the east of the country, Agence France Presse (AFP) reported. Riots also flared up in the Maghnia region close to the border with Morocco in the west, AFP said. Butane gas and fuel oil are used as the main source of fuel to heat homes and cook food in Algeria's remote mountain areas.
",business
"UK young top Euro earnings league

British children enjoy the highest average annual income in Europe - more than double that of Spanish or Italian youngsters, a report suggests.

Children in the UK between the ages of 10 and 17 had an annual income of £775, said market analyst Datamonitor. They use ""pester power"" to get their parents to stump up nearly a third of this income, the report said. As for how they spend their cash, the bulk goes on personal care, soft drinks and food, Datamonitor said.

Datamonitor adds that British teenagers are keen on personal care because it helps them combine two seemingly contradictory emotional needs - the desire to fit in and the desire to express their individuality.

British teenage girls, compared to their counterparts in seven European countries, are the most keen to use make-up products. Nearly three out of four girls said they used make-up. According to the Datamonitor report the trend marked British teenagers out as ""particularly important to cosmetics manufacturers as they are likely to experiment more with brands and products and form long-term beauty routines"". And the good times are likely to keep rolling for British children, as the report predicts that they will still be topping the earnings table in 2008.
",business
"Saudi NCCI's shares soar

Shares in Saudi Arabia's National Company for Cooperative Insurance (NCCI) soared on their first day of trading in Riyadh.

They were trading 84% above the offer price on Monday, changing hands at 372 riyals ($99; £53) after topping 400 early in the day. Demand for the insurer's debut shares was strong - 12 times what was on sale. The listing was part of the country's plans to open up its insurance market and boost demand in the sector. Deregulation is expected to boost demand for accident and damage cover.

Previously, only NCCI has been legally allowed to offer insurance products within Saudi Arabia. However, the authorities have turned a blind eye to the many other firms selling insurance. Saudi Arabia now wants a fully functioning insurance industry and is introducing legislation that will clamp down on unauthorised companies. Policy-makers also want to make having insurance more of a requirement, but first have to take steps to boost public confidence in the system, analysts said. As a result, NCCI is being developed as the industry's flagship firm - publicly-listed, with audited accounts. Saudi Arabia sold 7 million NCCI shares, or about 70% of the company's total capital last month. More than 800,000 applicants got 9 shares each for 205 riyals apiece.
",business
"Rusedski forced out in Marseille

Greg Rusedski was forced to withdraw from the Open 13 in Marseille on Thursday with a rib injury.

The British number two had been scheduled to play qualifier Sebastien de Chaunac, who beat world number five Guillermo Coria 6-4 7-5 in round one. But Rusedski was unable to take to the court because of a problem with the left-hand side of his rib-cage. American Taylor Dent caused a shock with a 7-6 6-2 victory over second seed David Nalbandian. But third seed Joachim Johansson made it through after beating Frenchman Gilles Simon 7-6 6-3 while in the first match of the day, sixth seed Feliciano Lopez defeated Ivo Karlovic. There were also wins for Slovakia's Karol Beck and Croatian duo Ivan Ljubicic and Mario Ancic.
",sport
"Veteran Martinez wins Thai title

Conchita Martinez won her first title in almost five years with victory over Anna-Lena Groenefeld at the Volvo Women's Open in Pattaya, Thailand.

The 32-year-old Spaniard came through 6-3 3-6 6-3 for her first title since Berlin in 2000. ""It feels really good,"" said Martinez, who is playing her last season on the Tour. ""To come through like that in an important match feels good. ""It's been nearly five years and I didn't think I could do it."" Groenefeld was the more powerful player but could not match her opponent's relentless accuracy. ""It was my first final, a new experience,"" said the German. ""I think she played a good match, a tough match, but I tried to stay in there. I think the whole week was good for me.""
",sport
"Injury sidelines Philippoussis

Mark Philippoussis withdrew from the Sydney International tennis tournament as expected on Sunday after suffering a groin injury during the Hopman Cup.

His participation in the Australian Open, which begins on 17 January in Melbourne, also remains in doubt. Defending women's champion Justine Henin-Hardenne is also out of the Sydney event because of a knee injury. In the only main draw men's or women's singles match on Sunday, Nathalie Dechy beat American Lisa Raymond 7-5 6-3. Number one men's seed Lleyton Hewitt begins his quest for a fourth Sydney title on Tuesday when he plays Karol Beck. Lindsay Davenport, top seed in the women's draw, has been handed a first-round bye and plays France's Dechy in the second round on Tuesday.
",sport
"Dent continues Adelaide progress

American Taylor Dent reached the final of the Australian hardcourt event in Adelaide with a crushing 6-1 6-1 win over Argentine Juan Ignacio Chela.

Dent will meet Swede Joachim Johansson on Sunday after the second seed survived a tense tie-break to defeat Belgium's Olivier Rochus 6-1 7-6 (7/5). Johansson, the boyfriend of Lleyton Hewitt's sister Jaslyn, received strong crowd support on Saturday. ""It feels like home for me, because Jaslyn lives here,"" said Johansson. Rochus was leading 5-4 in the second set tiebreak but his concentration was ruffled by a disputed line call and the match slipped away. ""It was so close - one mistake like this and the match is over, it's tough. For me, it was clearly out,"" Rochus said.
",sport
"Ivanovic seals Canberra victory

Serbia's Ana Ivanovic captured her first WTA title with a straight-sets victory over Hungarian Melinda Czink in the final of the Canberra Classic.

The 17-year-old took 83 minutes to take the match 7-5 6-1. Ivanovic beat Czink in the last round of qualifying but the Hungarian made the main draw as a lucky loser after Katarina Srebotnik withdrew injured. Ivanovic said: ""I was really nervous in the beginning, but I pulled through and didn't do too much wrong."" A junior Wimbledon finalist last year, she added: ""It's my first WTA title, and to win it has really given me more energy to practice and improve."" Ivanovic will play 32nd seed Iveta Benesova of the Czech Republic in the first round.said of the Australian Open in Melbourne.
",sport
